{"schemaVersion":"oldko.contract-registry/v1","generatedFor":"WS39","baseRef":"main","baseCommit":"a1c1d6b3e9aeb07fd066cee8a41714685557dddf","policyVersion":"1.0.0","contracts":[{"id":"character.create.session-to-rules","schemaVersion":"oldko.contract/v1","contractVersion":"1.0.0","required":true,"provider":{"ws":"WS03","branch":"ws03-ko1298-session","interfaceStatus":"partial"},"consumer":{"ws":"WS34","branch":"ws34-character-rules","interfaceStatus":"branch-empty"},"expected":{"methods":["validateCharacterCreate","createCharacterResult"],"fields":["accountId:string","slot:uint8","name:string","nation:uint8","race:uint8","classId:uint16","face:uint8","hair:uint8"],"semantics":["server-authoritative-validation","explicit-accept-reject-result"]},"actual":{"methods":[],"fields":[],"semantics":["WS03-create-select-response-missing","WS34-ahead-by-0"]},"assessment":{"breaking":true,"codes":["MISSING_INTERFACE","MISSING_REQUIRED_METHOD","MISSING_REQUIRED_FIELDS"],"recommendedOwnerWs":"WS34","notes":"WS03 explicitly reports create/select responses missing; WS34 currently has no branch changes."},"sourceRefs":["ws03-ko1298-session:workstreams/ws03/STATUS.md","ws34-character-rules:compare(main..branch)=identical"]},{"id":"world.entry.session-to-world","schemaVersion":"oldko.contract/v1","contractVersion":"1.0.0","required":true,"provider":{"ws":"WS03","branch":"ws03-ko1298-session","interfaceStatus":"partial"},"consumer":{"ws":"WS14","branch":null,"interfaceStatus":"missing-branch"},"expected":{"methods":["handoffSelectedCharacter","bootstrapWorldSession"],"fields":["sessionId:string","characterId:string|integer","zoneId:integer","position:object"],"semantics":["post-select-authoritative-handoff","disconnect-ownership"]},"actual":{"methods":[],"fields":[],"semantics":["WS03-post-select-bootstrap-missing","WS14-branch-missing"]},"assessment":{"breaking":true,"codes":["MISSING_PROVIDER_CONSUMER_BOUNDARY","MISSING_CONSUMER_BRANCH"],"recommendedOwnerWs":"WS14","notes":""},"sourceRefs":["ws03-ko1298-session:workstreams/ws03/STATUS.md","branch-search:ws14=none"]},{"id":"movement.world-to-sync","schemaVersion":"oldko.contract/v1","contractVersion":"1.0.0","required":true,"provider":{"ws":"WS14","branch":null,"interfaceStatus":"missing-branch"},"consumer":{"ws":"WS15","branch":"ws15-movement-sync","interfaceStatus":"published"},"expected":{"methods":["zoneBounds.isValidPosition","registerSession","teleport"],"fields":["sessionId:string","entityId:string|integer","zoneId:integer","position:object","headingRaw:int16"],"semantics":["authoritative-spawn-baseline","warp-not-normal-move"]},"actual":{"methods":[],"fields":[],"semantics":["WS15-consumer-contract-published","WS14-provider-missing"]},"assessment":{"breaking":true,"codes":["MISSING_PROVIDER_BRANCH","MISSING_REQUIRED_METHOD"],"recommendedOwnerWs":"WS14","notes":""},"sourceRefs":["ws15-movement-sync:workstreams/ws15/INTEGRATION_PATCH.md","branch-search:ws14=none"]},{"id":"npc.world-to-npc","schemaVersion":"oldko.contract/v1","contractVersion":"1.0.0","required":true,"provider":{"ws":"WS14","branch":null,"interfaceStatus":"missing-branch"},"consumer":{"ws":"WS16","branch":"ws16-npc-world","interfaceStatus":"published"},"expected":{"methods":["resolveTerrainY","dispatchNpcOpcode"],"fields":["zoneId:integer","position:object"],"semantics":["real-terrain-height","authenticated-game-socket-dispatch"]},"actual":{"methods":[],"fields":[],"semantics":["WS16-awaits-terrain-y-and-opcode-wiring","WS14-provider-missing"]},"assessment":{"breaking":true,"codes":["MISSING_PROVIDER_BRANCH","MISSING_REQUIRED_METHOD"],"recommendedOwnerWs":"WS14","notes":""},"sourceRefs":["ws16-npc-world:workstreams/ws16/STATUS.md","branch-search:ws14=none"]},{"id":"merchant.npc-to-economy","schemaVersion":"oldko.contract/v1","contractVersion":"1.0.0","required":true,"provider":{"ws":"WS16","branch":"ws16-npc-world","interfaceStatus":"published"},"consumer":{"ws":"WS22","branch":"ws22-merchant-economy","interfaceStatus":"published"},"expected":{"methods":["assertInteraction","getOffer"],"fields":["npcSellPrice:integer","npcBuyPrice:integer","canBuy:boolean","canSell:boolean"],"semantics":["npc-type-zone-range-state-validation","server-authoritative-price"]},"actual":{"methods":["NpcInteractionRouter.route"],"fields":["context.session:object","context.npc:object","npc.sellingGroup:uint32"],"semantics":["unknown-npc-check","zone-check","merchant-callback","no-range-validation","no-offer-price-api"]},"assessment":{"breaking":true,"codes":["MISSING_REQUIRED_METHOD","MISSING_RANGE_SEMANTIC","MISSING_AUTHORITATIVE_PRICE_INTERFACE"],"recommendedOwnerWs":"WS16","notes":""},"sourceRefs":["ws16-npc-world:services/ko1298-npc/router.js","ws22-merchant-economy:workstreams/ws22/INTEGRATION_PATCH.md"]},{"id":"quest.npc-to-quest","schemaVersion":"oldko.contract/v1","contractVersion":"1.0.0","required":true,"provider":{"ws":"WS16","branch":"ws16-npc-world","interfaceStatus":"published"},"consumer":{"ws":"WS23","branch":"ws23-quest-events","interfaceStatus":"published"},"expected":{"methods":["questRouter.route"],"fields":["npcId:integer","action:string|integer","characterId:string|integer","player.level:integer","player.classId:integer","player.nationId:integer"],"semantics":["instance-to-template-validation","verified-menu-action","interaction-range-validation"]},"actual":{"methods":["NpcInteractionRouter.route"],"fields":["instanceId:uint16","context.session:object","context.npc:object"],"semantics":["instance-validation","zone-check","no-action-field","no-range-validation"]},"assessment":{"breaking":true,"codes":["MISSING_REQUIRED_FIELDS","MISSING_VERIFIED_ACTION","MISSING_RANGE_SEMANTIC"],"recommendedOwnerWs":"WS16","notes":""},"sourceRefs":["ws16-npc-world:services/ko1298-npc/protocol.js","ws16-npc-world:services/ko1298-npc/router.js","ws23-quest-events:workstreams/ws23/INTEGRATION_PATCH.md"]},{"id":"inventory.items-to-economy","schemaVersion":"oldko.contract/v1","contractVersion":"1.0.0","required":true,"provider":{"ws":"WS17","branch":"ws17-item-inventory","interfaceStatus":"published"},"consumer":{"ws":"WS22","branch":"ws22-merchant-economy","interfaceStatus":"published"},"expected":{"methods":["canReceiveNpcPurchase","addNpcPurchase","getOwnedItem","removeOwnedItem","countSerial","canReceiveTrade","transferItem"],"fields":["tx:transaction-context"],"semantics":["caller-supplied-single-transaction","global-serial-authority","atomic-coin-item-trade"]},"actual":{"methods":["createItem","move","equip","unequip","moveToInn","moveFromInn"],"fields":["repository.transact(ownerId,work):function"],"semantics":["WS17-opens-owner-transaction","global-serial-index-in-memory","no-caller-tx-port"]},"assessment":{"breaking":true,"codes":["MISSING_REQUIRED_METHOD","TRANSACTION_OWNERSHIP_CONFLICT"],"recommendedOwnerWs":"WS17","notes":""},"sourceRefs":["ws17-item-inventory:services/ko1298-items/service.js","ws17-item-inventory:services/ko1298-items/in-memory-repository.js","ws22-merchant-economy:workstreams/ws22/INTEGRATION_PATCH.md"]},{"id":"inn.items-to-storage","schemaVersion":"oldko.contract/v1","contractVersion":"1.0.0","required":true,"provider":{"ws":"WS17","branch":"ws17-item-inventory","interfaceStatus":"published"},"consumer":{"ws":"WS33","branch":"ws33-inn-storage","interfaceStatus":"published"},"expected":{"methods":["createWs17CompatibleItemPort"],"fields":["templates.get:function","createItemInstance:function","withQuantity:function"],"semantics":["account-scoped-storage","WS17-item-serial-authority","WS33-owned-cross-scope-transaction"]},"actual":{"methods":["createWs17CompatibleItemPort"],"fields":["templates.get:function","createItemInstance:function","withQuantity:function"],"semantics":["account-scoped-storage","WS17-item-serial-authority","WS33-owned-cross-scope-transaction"]},"assessment":{"breaking":false,"codes":["ADAPTER_COMPATIBLE"],"recommendedOwnerWs":"WS33","notes":"WS33 explicitly adapts WS17 pure item helpers and owns the account+character atomic transaction instead of nesting WS17 owner transactions."},"sourceRefs":["ws17-item-inventory:services/ko1298-items/item-instance.js","ws33-inn-storage:services/ko1298-inn/item-port.js","ws33-inn-storage:workstreams/ws33/INTEGRATION_PATCH.md","ws33-inn-storage:workstreams/ws33/STATUS.md"]},{"id":"combat.combat-to-mobs","schemaVersion":"oldko.contract/v1","contractVersion":"1.0.0","required":true,"provider":{"ws":"WS19","branch":"ws19-combat-core","interfaceStatus":"published"},"consumer":{"ws":"WS25","branch":"ws25-mob-ai","interfaceStatus":"published"},"expected":{"methods":["isTargetAlive","canAggro"],"fields":["target.id:string|integer","target.zoneId:integer","target.position:object"],"semantics":["authoritative-life-state","explicit-mob-target-policy"]},"actual":{"methods":["createCombatant","CombatService.normalAttack"],"fields":["lifeState:ALIVE|DEAD","hp:number"],"semantics":["authoritative-life-state-available","no-canAggro-or-canMobTarget-public-api"]},"assessment":{"breaking":true,"codes":["MISSING_REQUIRED_METHOD","MISSING_AGGRO_POLICY_INTERFACE"],"recommendedOwnerWs":"WS19","notes":""},"sourceRefs":["ws19-combat-core:services/ko1298-combat/combat-service.js","ws25-mob-ai:workstreams/ws25/INTEGRATION_PATCH.md"]},{"id":"loot.mobs-to-loot","schemaVersion":"oldko.contract/v1","contractVersion":"1.0.0","required":true,"provider":{"ws":"WS25","branch":"ws25-mob-ai","interfaceStatus":"published"},"consumer":{"ws":"WS26","branch":"ws26-drop-loot","interfaceStatus":"published"},"expected":{"methods":["createFromMobDeath"],"fields":["eventId:string","mobInstanceId:string","mobTemplateId:string|integer","killerCharacterId:string|integer","zoneId:integer","position:object","diedAt:number"],"semantics":["stable-death-event-idempotency-key"]},"actual":{"methods":["onMobStateChange"],"fields":["mob.id:string","mob.templateId:string|integer","mob.zoneId:integer","mob.position:object","event.type:string","event.atMs:number"],"semantics":["dead-state-event","meta-pa